caution,meaning
do_not_treat_lambda_calculus_as_ordinary_algebra,"Lambda calculus is a formal system of functions, application, abstraction, and reduction."
do_not_confuse_lambda_calculus_with_machine_hardware,"Church models computation through expressions, not physical machines."
do_not_ignore_binding_and_scope,Substitution requires careful handling of free and bound variables.
do_not_treat_church_turing_thesis_as_simple_theorem,The thesis connects informal effective calculability with formal models.
do_not_forget_undecidability,Church's legacy includes formal limits on general decision procedure.
