item,description,review_question
note_g_bernoulli_procedure,A machine-oriented table of operations for Bernoulli numbers,How does the procedure encode ordered machine action?
analytical_engine_general_machine,The Analytical Engine joins store mill cards and operations,How is the machine more than a calculator?
computation_beyond_arithmetic,Lovelace imagines operations on represented relations beyond number,What makes computation symbolically general?
music_pattern_symbolic_generality,Music shows how pattern and relation can be represented for operation,How can non-arithmetic domains become computational?
lovelace_objection_machine_limits,Lovelace argues the Engine cannot originate anything independently,What does the machine depend on?
translation_notes_authorship,Translation and notes become intellectual contribution,How do commentary and interpretation create knowledge?
gender_credit_recognition,Lovelace's memory is shaped by myth dismissal collaboration and recognition,How should credit be assigned responsibly?
