case_name,problem_context,style_choice,style_clarity,state_visibility,abstraction_fit,composability,testability,error_handling,traceability,performance_fit,team_readability,governance_readiness,style_quality,style_risk,diagnostic
Functional data transformation,A reproducible data workflow maps raw records into validated derived outputs,Functional core with pure transformation functions and explicit effect boundaries,0.9,0.92,0.88,0.92,0.94,0.84,0.88,0.82,0.84,0.9,88.56,11.25,"strong computational style with clear state, abstraction, tests, traceability, and governance"
Object-oriented domain model,A case-management system organizes entities responsibilities states and lifecycle rules,Object-oriented model with explicit interfaces validation methods and audit events,0.86,0.8,0.9,0.82,0.84,0.86,0.88,0.8,0.86,0.88,85.12,14.0,"strong computational style with clear state, abstraction, tests, traceability, and governance"
Declarative query layer,A research library retrieves and aggregates records using relational queries,SQL-style declarative queries with documented schemas indexes and query plans,0.88,0.84,0.88,0.82,0.82,0.8,0.86,0.88,0.86,0.86,85.0,15.0,"strong computational style with clear state, abstraction, tests, traceability, and governance"
Event-driven platform workflow,A platform responds to uploads edits approvals publication events and notifications,Event-driven workflow with structured event records idempotent handlers retries and audit logs,0.8,0.78,0.82,0.8,0.78,0.86,0.9,0.84,0.78,0.88,82.32,17.5,usable computational style with review needs
Hybrid scientific workflow,A computational model combines array programming scripting functional transformations and generated reports,Hybrid workflow with vectorized numerical code pure functions shell automation and reproducible outputs,0.86,0.84,0.86,0.88,0.88,0.82,0.9,0.88,0.84,0.88,86.36,14.0,"strong computational style with clear state, abstraction, tests, traceability, and governance"
