item,description,review_question
word_history_not_concept_history,The word algorithm and the general concept of algorithm do not begin at the same point,Is the story confusing etymology with invention?
al_khwarizmi_without_myth,Al-Khwarizmi should be honored precisely without being turned into a total origin myth,Which claim is historically scoped?
procedures_before_algorithm_word,Stepwise procedures existed before the modern word algorithm,Which older procedures are being described carefully?
translation_reception_institutional_memory,Transmission systems make methods durable,Who translated copied taught used and institutionalized the method?
great_man_vs_network_history,Individuals matter but networks make work possible and lasting,Who gets erased by a single-hero story?
civilizational_erasure_token_inclusion,Inclusion requires context not name-dropping,Does the story explain method context and transmission?
ai_age_origin_story_caution,Modern AI narratives can misuse ancient origins,Does the story distinguish procedure machine statistics agency and governance?
