case_name,computation_context,formal_claim,expression_clarity,binding_safety,substitution_discipline,reduction_traceability,evaluation_strategy_clarity,recursion_awareness,type_discipline_clarity,proof_connection,implementation_relevance,governance_readiness,lambda_reasoning_quality,formalization_risk,diagnostic
Identity reduction,Basic beta reduction of an identity function,The expression lambda x dot x applied to a reduces to a,0.92,0.9,0.92,0.9,0.82,0.7,0.82,0.76,0.78,0.74,83.4,18.0,"strong lambda-calculus reasoning posture with clear binding, substitution, typing, and reduction evidence"
Capture avoiding substitution,Substitution where variable names must be managed carefully,Alpha conversion prevents free variables from becoming accidentally bound,0.84,0.9,0.88,0.82,0.74,0.64,0.76,0.78,0.82,0.78,80.2,21.25,usable lambda-calculus reasoning posture with review needs
Fixed point recursion,Recursive behavior represented through fixed points,A fixed point combinator enables self referential computation,0.76,0.76,0.78,0.74,0.8,0.9,0.68,0.76,0.82,0.74,76.88,23.0,usable lambda-calculus reasoning posture with review needs
Typed function abstraction,Typed lambda expression used to model safe function application,A function with type A to B may only be applied to values of type A,0.86,0.84,0.82,0.78,0.76,0.68,0.92,0.86,0.86,0.82,82.36,19.0,"strong lambda-calculus reasoning posture with clear binding, substitution, typing, and reduction evidence"
Church numeral encoding,Numbers represented as repeated function application,Church numerals encode natural numbers with higher order functions,0.8,0.78,0.8,0.78,0.76,0.72,0.74,0.8,0.78,0.76,77.24,23.25,usable lambda-calculus reasoning posture with review needs
