item,description,review_question
algorithm_inventory,System owner purpose data vendor decision role worker impact and status,Can the organization identify and govern the workplace algorithm?
labor_impact_assessment,Hiring pay scheduling workload safety autonomy discipline and opportunity effects,How does the system change work and authority?
fairness_and_opportunity_review,Subgroup outcomes error rates rating bias access promotion and workload distribution,Does the system expand or restrict opportunity?
privacy_and_surveillance_review,Monitoring scope data minimization purpose limits retention and vendor access,Is data collection necessary and proportionate?
contestability_and_appeal,Notice reasons correction human review worker appeal and remedy,Can workers challenge consequential outputs?
human_review_and_worker_voice,Manager review worker feedback override and collective governance channels,Can human judgment and worker knowledge alter the system?
monitoring_and_stop_rule,Harms bias privacy incidents safety problems metric distortion and stop authority,Can unsafe or unfair systems be paused or retired?
safety_review,Work pace fatigue workload injury hazards and incident learning,Does efficiency depend on hidden human strain?
