case_name,problem_context,interface_design_choice,contract_clarity,schema_validation,error_behavior,versioning_strategy,documentation_quality,testability,coupling_control,observability,security_boundaries,governance_readiness,interface_quality,interface_risk,diagnostic
Internal scoring library API,A package exposes reusable scoring functions for validated case records,Typed function signatures explicit schema validation structured errors examples and unit tests,0.9,0.9,0.86,0.82,0.88,0.92,0.88,0.76,0.8,0.86,86.16,13.0,strong interface discipline
Public web API,External clients create records query status and retrieve reports through HTTP endpoints,OpenAPI specification versioned routes authentication scopes structured errors rate limits and request IDs,0.9,0.92,0.9,0.88,0.9,0.86,0.84,0.9,0.92,0.9,89.24,11.0,strong interface discipline
Event-driven workflow boundary,Services communicate through events that represent workflow state changes,Versioned event schemas idempotent consumers replay rules event logs and contract tests,0.86,0.88,0.84,0.88,0.84,0.84,0.88,0.88,0.84,0.88,86.16,14.25,strong interface discipline
Model prediction endpoint,A model endpoint returns scores used by a decision-support workflow,Input schema model version output semantics uncertainty notes monitoring fields and human-review constraints,0.86,0.88,0.84,0.86,0.86,0.82,0.82,0.88,0.88,0.9,85.92,14.75,strong interface discipline
Data contract boundary,A data pipeline stage consumes records and produces validated outputs for downstream systems,Versioned schemas required fields unit metadata validation reports provenance and compatibility tests,0.88,0.92,0.86,0.88,0.86,0.88,0.86,0.86,0.84,0.88,87.32,12.75,strong interface discipline
