claim_name,system_context,claimed_growth,input_definition_clarity,resource_scope_clarity,case_assumption_clarity,derivation_quality,tightness_clarity,benchmark_support,threshold_reporting,hidden_cost_review,governance_readiness,communication_clarity,big_o_claim_quality,big_o_claim_risk,diagnostic
Binary search lookup,Search sorted list or index,O(log n),0.92,0.86,0.84,0.88,0.84,0.82,0.78,0.76,0.78,0.86,83.84,16.6,usable Big-O claim with documentation or benchmark needs
All-pairs comparison,Compare each record against every other record,O(n^2),0.88,0.84,0.82,0.86,0.82,0.78,0.8,0.78,0.76,0.82,81.92,18.4,usable Big-O claim with documentation or benchmark needs
Efficient comparison sorting,Sort large list of comparable items,O(n log n),0.9,0.84,0.82,0.84,0.84,0.82,0.78,0.76,0.78,0.84,82.56,17.8,usable Big-O claim with documentation or benchmark needs
Vague efficient ranking claim,Ranking pipeline described only as efficient,not stated,0.36,0.32,0.28,0.24,0.2,0.3,0.22,0.26,0.28,0.24,27.24,73.0,high risk; Big-O claim may be unclear or unsupported
Manual review queue,Human review burden from automated flagging,O(n) or worse,0.78,0.72,0.7,0.66,0.62,0.68,0.64,0.72,0.76,0.7,69.68,30.2,partial Big-O discipline
